{
  "$schema": "../schema/block.schema.json",
  "format": 1,
  "id": "carousel",
  "kind": "carousel",
  "label": "Carousel",
  "hint": "Slides that move with arrows, dots, a swipe or on their own, and work with a keyboard and a screen reader",
  "category": "content",
  "isNew": true,
  "settings": {
    "perView": 1,
    "loop": true,
    "autoplay": false,
    "interval": 5,
    "arrows": true,
    "dots": true,
    "swipe": true,
    "start": 0,
    "parallax": 0
  },
  "root": {
    "type": "stack",
    "name": "Carousel",
    "w": 640,
    "h": 384,
    "layout": {
      "direction": "column",
      "gap": 16,
      "pad": [
        0,
        0,
        0,
        0
      ],
      "align": "center"
    },
    "sizeW": "fixed",
    "sizeH": "fit",
    "children": [
      {
        "type": "stack",
        "name": "View",
        "w": 640,
        "h": 360,
        "layout": {
          "direction": "row",
          "gap": 0,
          "pad": [
            0,
            0,
            0,
            0
          ],
          "align": "stretch"
        },
        "sizeW": "fill",
        "sizeH": "fixed",
        "clip": true,
        "radius": "design",
        "children": [
          {
            "type": "stack",
            "name": "Slides",
            "part": "track",
            "w": 1920,
            "h": 360,
            "layout": {
              "direction": "row",
              "gap": 0,
              "pad": [
                0,
                0,
                0,
                0
              ],
              "align": "stretch"
            },
            "sizeW": "fit",
            "sizeH": "fill",
            "children": [
              {
                "type": "stack",
                "name": "Slide {n}",
                "w": 640,
                "h": 360,
                "repeat": 3,
                "layout": {
                  "direction": "column",
                  "gap": 8,
                  "pad": [
                    24,
                    88,
                    24,
                    88
                  ],
                  "align": "center",
                  "justify": "center"
                },
                "sizeW": "fixed",
                "sizeH": "fill",
                "clip": true,
                "fill": "surface",
                "children": [
                  {
                    "type": "text",
                    "name": "Heading",
                    "w": 464,
                    "h": 40,
                    "sizeW": "fill",
                    "text": "Slide {n}",
                    "ink": "ink",
                    "typography": {
                      "role": "heading",
                      "size": 28,
                      "weight": 600,
                      "align": "center"
                    }
                  },
                  {
                    "type": "text",
                    "name": "Body",
                    "w": 464,
                    "h": 24,
                    "sizeW": "fill",
                    "text": "What this slide says.",
                    "ink": "ink",
                    "typography": {
                      "role": "body",
                      "size": 15,
                      "weight": 400,
                      "align": "center"
                    }
                  }
                ]
              }
            ]
          },
          {
            "type": "button",
            "name": "Previous",
            "part": "prev",
            "w": 44,
            "h": 44,
            "float": {
              "left": 16,
              "centreY": true
            },
            "fill": "accent",
            "ink": "on-accent",
            "radius": 22,
            "text": "←",
            "typography": {
              "role": "body",
              "size": 17,
              "weight": 600,
              "align": "center"
            }
          },
          {
            "type": "button",
            "name": "Next",
            "part": "next",
            "w": 44,
            "h": 44,
            "float": {
              "right": 16,
              "centreY": true
            },
            "fill": "accent",
            "ink": "on-accent",
            "radius": 22,
            "text": "→",
            "typography": {
              "role": "body",
              "size": 17,
              "weight": 600,
              "align": "center"
            }
          },
          {
            "type": "button",
            "name": "Pause",
            "part": "pause",
            "w": 76,
            "h": 32,
            "float": {
              "right": 16,
              "top": 16
            },
            "fill": "accent",
            "ink": "on-accent",
            "radius": 16,
            "text": "Pause",
            "typography": {
              "role": "body",
              "size": 15,
              "weight": 600,
              "align": "center"
            },
            "hidden": true
          }
        ]
      },
      {
        "type": "stack",
        "name": "Dots",
        "part": "dots",
        "w": 40,
        "h": 8,
        "layout": {
          "direction": "row",
          "gap": 8,
          "pad": [
            0,
            0,
            0,
            0
          ],
          "align": "center"
        },
        "sizeW": "fit",
        "sizeH": "fit",
        "children": [
          {
            "type": "ellipse",
            "name": "Dot {n}",
            "w": 8,
            "h": 8,
            "fill": "accent",
            "repeat": 3
          }
        ]
      }
    ]
  }
}
