{
  "$schema": "../schema/block.schema.json",
  "format": 1,
  "id": "banner",
  "kind": "notice",
  "label": "Banner",
  "hint": "A bar across the top of the window for news everyone should see, closed in one press",
  "category": "feedback",
  "isNew": true,
  "settings": {
    "position": "top-center",
    "delay": 0,
    "stay": 0,
    "remember": true
  },
  "root": {
    "type": "stack",
    "name": "Banner",
    "w": 1136,
    "h": 68,
    "layout": {
      "direction": "row",
      "gap": 16,
      "pad": [
        12,
        12,
        12,
        20
      ],
      "align": "center"
    },
    "sizeW": "fill",
    "sizeH": "fit",
    "fill": "ink",
    "radius": "design",
    "children": [
      {
        "type": "text",
        "name": "Message",
        "w": 956,
        "h": 24,
        "sizeW": "fill",
        "text": "Our opening hours change this week. See the new times before you visit.",
        "ink": "surface",
        "typography": {
          "role": "body",
          "size": 15,
          "weight": 500
        }
      },
      {
        "type": "button",
        "name": "Got it",
        "part": "dismiss",
        "w": 96,
        "h": 44,
        "fill": "surface",
        "ink": "ink",
        "radius": "design",
        "text": "Got it",
        "typography": {
          "role": "body",
          "size": 15,
          "weight": 600,
          "align": "center"
        }
      },
      {
        "type": "text",
        "name": "Close",
        "part": "dismiss",
        "w": 44,
        "h": 44,
        "text": "×",
        "ink": "surface",
        "typography": {
          "role": "body",
          "size": 28,
          "weight": 300,
          "align": "center"
        }
      }
    ],
    "raised": true
  }
}
